{
  "id": 1891659426828797,
  "name": "email.mfa.verify.code",
  "description": "MFA step-up email verification code",
  "type": "Mail",
  "title": {
    "zh-CN": "您的 IDMP 二次认证验证码",
    "en": "Your IDMP verification code",
    "es": "Su código de verificación de IDMP",
    "ko": "IDMP 인증 코드"
  },
  "content": {
    "zh-CN": "<div style=\"max-width:680px;margin:0 auto;font-family:'Helvetica Neue',Arial,sans-serif;color:#333;font-size:16px;line-height:1.6;\"><p style=\"margin-bottom:24px;\">您好 {userName}，</p><p>我们收到一个需要进行二次认证的敏感操作请求。</p><p>为保障您的账号安全，请使用下方验证码继续操作。</p><p style=\"margin:24px 0;\">您的验证码是：<span style=\"font-weight:bold;font-size:22px;letter-spacing:2px;color:#0052CC;\">{validationCode}</span></p><p style=\"font-style:italic;color:#747474;\">该验证码将在 {codeTTL} 分钟内有效。</p><p>如果这不是您本人的操作，请忽略此邮件或立即联系您的管理员。</p><p style=\"margin-top:32px;\">此致，</p><p>IDMP 团队</p></div>",
    "en": "<div style=\"max-width:680px;margin:0 auto;font-family:'Helvetica Neue',Arial,sans-serif;color:#333;font-size:16px;line-height:1.6;\"><p style=\"margin-bottom:24px;\">Hi {userName},</p><p>We received a request to perform a sensitive operation that requires additional verification.</p><p>To keep your account secure, please use the verification code below to continue.</p><p style=\"margin:24px 0;\">Your verification code is: <span style=\"font-weight:bold;font-size:22px;letter-spacing:2px;color:#0052CC;\">{validationCode}</span></p><p style=\"font-style:italic;color:#747474;\">This code is valid for the next {codeTTL} minutes.</p><p>If you did not request this operation, please ignore this email or contact your administrator immediately.</p><p style=\"margin-top:32px;\">Best regards,</p><p>The IDMP Team</p></div>",
    "es": "<div style=\"max-width:680px;margin:0 auto;font-family:'Helvetica Neue',Arial,sans-serif;color:#333;font-size:16px;line-height:1.6;\"><p style=\"margin-bottom:24px;\">Hola {userName}:</p><p>Recibimos una solicitud para realizar una operación sensible que requiere verificación adicional.</p><p>Para mantener su cuenta segura, utilice el siguiente código de verificación para continuar.</p><p style=\"margin:24px 0;\">Su código de verificación es: <span style=\"font-weight:bold;font-size:22px;letter-spacing:2px;color:#0052CC;\">{validationCode}</span></p><p style=\"font-style:italic;color:#747474;\">Este código es válido durante los próximos {codeTTL} minutos.</p><p>Si no solicitó esta operación, ignore este correo o contacte de inmediato con su administrador.</p><p style=\"margin-top:32px;\">Atentamente,</p><p>El equipo de IDMP</p></div>",
    "ko": "<div style=\"max-width:680px;margin:0 auto;font-family:'Helvetica Neue',Arial,sans-serif;color:#333;font-size:16px;line-height:1.6;\"><p style=\"margin-bottom:24px;\">안녕하세요 {userName}님,</p><p>추가 인증이 필요한 민감한 작업 요청을 받았습니다.</p><p>계정을 안전하게 보호하기 위해 아래 인증 코드를 사용하여 계속 진행하세요.</p><p style=\"margin:24px 0;\">인증 코드: <span style=\"font-weight:bold;font-size:22px;letter-spacing:2px;color:#0052CC;\">{validationCode}</span></p><p style=\"font-style:italic;color:#747474;\">이 코드는 앞으로 {codeTTL}분 동안 유효합니다.</p><p>본인이 요청하지 않았다면 이 이메일을 무시하거나 즉시 관리자에게 문의하세요.</p><p style=\"margin-top:32px;\">감사합니다,</p><p>IDMP 팀 드림</p></div>"
  }
}
